東北ビル管財株式会社　弘前支店,１９７７年,１０２人　　,データなし,２５人,７７人,３０００万円,サービス業,支店長　佐藤　公彦,-,"総合建物管理（清掃、設備、給食他）請負業務、ホテル管理、産廃収集運搬、

害虫駆除、初任者講習、一派労働者派遣事業",平成２５年　２人,西村　亜希子さん,入社８年目　,４０歳,持っている経理の経験と資格を活かしたいという気持ちがあり、東北ビル管財では様々な事業を行っているので知識の幅が広がると思い入社。,"・経理

・庶務",月０～２０時間,弊社は、お客様のニーズに応えられるような多種多様な業種を取り扱ってえおりますので、景気の荒波にも左右されないよう日々努力をしています。また、経験豊富なスタッフが多くいますので、技術と知識を身につけながら資格取得することも可能です。,青森県での販路拡大を図りながら、お客様のニーズに応えられるように事業展開していきたい。それが、従業員一人一人の幸せに繋がると思います。,"柔軟性が高い

やる気があるハングリーな、挫折しないような人",加入保険：雇用・労災・健康・厚生・財形,やる気があり、ハングリー精神があることやどんなことにも挫折しないこと。自分の行動に責任を持ち、向上心があること。,バドミントン・卓球・テニス・ゴルフ・軽音クラブ（バンド）・旅行（年１回くらい）,何のために働くのか？（目標持ってどこまでやれるか）,幅広い職種があるので様々なことを学べていけるという魅力があり、自分を試せるような環境だと感じました。また、職場では常にコミュニケーションをとっていい雰囲気を保っていて、教え合いをして教育の場となっていて一致団結しているようにみられました。企業自体が従業員を大事にしているので安定しており、将来性も感じて魅力がたくさん詰まった企業だと思います。,お客様のニーズに応えられるように日々勉強の姿勢で成長意欲が高く、上昇志向が強く感じられました。自分のために動くのではなくお客様にとって何が必要か、何を求められているのかを敏感に感じ取り、即実行するような方々でした。また、一期一会を大事にし、お客様のことを考えてくれる方々でした。
扶桑電通株式会社　青森営業所,昭和２３年３月,１６人,０人,１４人,２人,３９９億２２１３万円 ,卸売業,代表取締役社長　児玉　栄次,総務管理課　橋本俊夫,ネットワークとソリューションに関わる、ＩＣＴ基盤構築ビジネス、設計、販売、施工並びに保守,平成２５年　１５人,永田　大樹さん,入社４年,２６歳,古くからのしきたり等が嫌だったが、現東北支店長との面接時に、この企業は時代のニーズに合わせてサービス内容を変化させていく柔軟性を持った企業であることを聞き、自分に合っていると感じたから。,"・ＩＴ関連のサポート

・通信、情報機器に関する営業活動

・新入社員時代は覚えることが仕事（社内の流れ、事務的な仕事）",月０～２０時間,"・全国に54事業所で展開しており、窓口を一本化することでスムーズにサービスを提供できる

・アフターサービスはもちろん、営業・各技術職の協力による品質の良いサービスの提供",顧客満足度の向上を目指し、取扱いサービスの拡充、営業マンの育成、提案力の強化を図り続けます,"【主体性がある】

　業務をするうえで最も重要な能力になります","【教育制度】

・研修（教育社員研修会（新入社員)、中堅社員、管理職）

　→会社の方針として、社員のスキルアップ・内部統制に尽力

・入社後の研修終了後からはＯＪＴ制度で仕事に慣れていく

【福利厚生】

・保険（雇用　・　労災　・　健康　・　厚生）

・手当（時間外勤務手当、休日勤務手当、家族手当、通勤手当 等）

・財形貯蓄制度、社員持株会制度、企業年金、育児・介護休業制度、独身寮（東京）、研修センター、資格取得支援制度、健康保健組合の提携施設（宿泊施設、レジャー施設、スポーツクラブなど)を特別価格で利用可能","自発的な発言ができること。

質問に対して正確に、経緯を含めて説明できること。","・社員旅行

・忘年会

・個人的なコミュニケーションの範囲で飲み会",弊社の企業理念は何ですか？また、それをどう受け止めましたか？,上下関係はしっかりしつつも、社員同士は非常に仲の良さそうな印象を受けた。営業所内は各部署がワンフロアで繋がっており、意思疎通がしやすく、仕事もスムーズにできそうな環境だった。社内の雰囲気も良く、各種手当も充実しており、ワークライフバランスを考慮してくれている職場というのは、学生にとって魅力の大きいポイントだった。,皆気さくで話しやすい方たちだった。インタビュー時にも仰っていたが、「仕事の時は仕事、遊びの時は遊び」と、メリハリがある職場というのが役員の方たちからもうかがえた。また、こちらが投げかける質問以上の受け答えをしてくださり、会話をすること自体が楽しめた。
株式会社セントラルパートナーズ東北支店,平成18年,200人,０人,３１人,４９人,１億９千万円,保険代理業,代表取締役社長　長澤篤治,人事本部　今村由紀,"コールセンター事業、保険会社の代理店事業を展開

保険コンサルティング、チームによる提案営業",平成25年　１人,佐藤　翔太さん,入社２年目　,２４歳,就職するにあたり、父が長く入院した際に親の知人がアフラックの保険を紹介してくれた事を思い出したのがきっかけ。地元の青森で働きたい事もあり、地元思考のセントラルパートナーズに興味を持った。,"・加入している保険内容・保障の確認

・将来的な安心のための保険を提案",月２１～３５時間,直接、お客様と会話出来る方が密接な関係を作り易いが、その分関われるお客様が狭まってしまう。コールセンターという形を取る事で、関われるお客様の地域を広げている。さらに、対面で接客するのと同じくらいの質で対応出来るよう様々な工夫がなされている。コール席が近く、隣りで常にサポート出来るよう、空いていれば席を詰め、困ったら対応者を変更など、電話業務でありながらチームでの連携が企業の強みである。,現在、スカパーと提携を結んでおり、お客様用の冊子での、アフラック広告ページの問い合わせ先が弊社になっており、実績を積むことで信頼を得て、さらなる事業領域の拡大を目指す。顧客満足度や生産性の向上も目標である。,"主体性がある社員

お客様や他の社員と感情や悩みなどを共有できる人材が望ましい。共有するためには、自分の意見を表現する事が必要なため、昇給方法も勤務年数ではなく、実績に応じてどんどん上がって行くなどの評価制度を取っている事も主体性を必要な要因となっている。",基本的に地元採用という方針だが、そうでない人には家賃の35％を会社が負担することとなっている。歩合制ということもあるが、キャンペーン金という、月毎に個人の実績を評価して給与にプラスする制度もあり高いモチベーションを維持出来るようにもなっている。チームでの目標が設定されており、チームのコミュニケーションを図れるよう会食費なども会社からでるようになっている。,電話での業務になるが、しゃべる事が得意で無い人も実際に働いており、先輩や上司が常にサポートしてくれるようになっているので、不安を持たず働いて欲しい。,飲み会は多く、飲みすぎて遅刻した事もあるというエピソードもでました。社員旅行は一年に一度必ずあり、ちなみに去年はグアムとの事。チームで業務を行っている事もあり、部活動のような空気感を感じました。,当社の拠点３店舗の市町村名を答えよ。,大きなビルの中にオフィスがあり、中の大きさは90席座れるくらいの大きさで、多くの人が仕事をしていた。取材をしていて初めてコールセンターの中を見させていただいたが、常にお客様とお電話をしているだけではなく、全体で鼓舞してやる気に満ち溢れているオフィスだった。社員旅行は3年連続でグアムに行っているといっていて、とてもうらやましいと思った。,多くインタビューしてきた中で、女性の数少ない人事だった。さらに珍しいことと感じたのは、設立当初からのメンバーであるということと前職とは全く違う業種で仕事をしていたといっていた。とてもポジティブでアグレッシブな人事の方だと感じた。休日の日にもスケジュール管理をしっかりしていて休日を最大限に活用すると言っていてＯＮＯＦＦがしっかりしている方だと感じた。
プライベートサロンRiとBiのたまご,平成１９年,２人,１人,０人,３人,-,エステティックサロン,代表 須藤　友子,,"エステティシャン業務

・フェイシャルエステ、ボディエステ、ブライダルエステの施術

・取引先にパンフレットを配るなど周知活動、事務処理、サロン業務全般、化粧品など取扱商品のご提案",-,石岡　真由美さん,入社2年目,38歳,以前お客様と接する仕事をしていたが、そんな中以前からの知り合いでプライベートサロンRiとBiのたまごの代表の須藤さんに誘われたから。,"・エステ　　　　　　・予約等お客様の対応や事務処理などサロン業務
・ブライダルフェア（ホテルなど）への参加",月０～２０時間,"独自のサービスでお客様のニーズに合わせてメニューを作り変え、全力でサポートをするところや情報公開を惜しまず、他社と情報を共有する特徴がある。

また、教育の面が充実しており他社と合同で研修をする、カウンセリングを学びお客様のニーズに応えられるよう、人間関係を崩さないようなセミナーにも参加している。

お客様のニーズに合わせるということを第一にしている。

従業員の考えを汲んでくれるので、働きやすい。","更にお客様の目指すところをサポートできるような企業になり、全国にサロン展開していき、幸せに貢献し幸せを広げていけるようになる。

また従業員がもっと楽しく仕事ができ、もっと笑顔と幸せがあふれる企業にしていきたい。

「エステ」という仕事のハードルを下げて気軽に利用できるようにしたい。",傾聴力がある（成長していくために、意見を素直に受け入れる）,"教育制度：東京研修、セミナー

福利厚生：育児休暇有　加入保険：雇用、労災",自分の考えをはっきりと伝えることができ、意見を素直に受け入れ一緒に成長できること。お客様の幸せに貢献することに幸せを感じられること。,"ランチ（頻繁）、飲み（年3～4回）、旅行（たまに）

いずれも希望者のみ。",あなたの母親はどんな方ですか？,従業員のことをしっかりと考えてくれており、働きやすい明るい職場というのが一番強いイメージでした！エステという専門的なところかと思いましたが、教育面も良く、研修もあり一緒に学んでいこうという姿勢でとても働きやすい環境でした。とても働きがいのある、いい企業だと思います。,自分の意見を押し付けるのではなく、相手と自分の違いをしっかりと考えて行動をしていくような方でした。お客様のことだけを考えるのではなく従業員のこともしっかりと考えて周りをよく見ており、働きやすい環境を整えてくれて、成長意識が強く全員で成長しようと考えてくれる方でした。
株式会社ページワン,１９８９年,１９人,０人,１３人,５人,５０００万円,ソフトウェア業,代表取締役　木村　譲,-,"・コンピューターソフトの開発

・ネットワークソリューション

・インターネット関連

・システム開発及びDynamicsCRMのカスタマイズ",平成２５年　０人,長崎　薫美さん,入社5年目,24歳,"市内の専門学校を卒業後から就職活動を始めた。

専門学校で学んだ知識をＩＴ業界で活用したいと思っていたい、青森市内で働きたいと考えていた時に、求人の出ていたこの会社を受けようと思った。","・システム/プログラムの作成/点検

・Dynamics CRM のカスタマイズ

・Ｗebサイトの作成/デザイン",月２１～３５時間,"「下請けでないことが強み」

仕事の拠点が東京にあるために大手企業や大学を主な取引先としている。

Microsoft社やGoogle社のパートナー企業であるために、最新の技術に関する情報に触れることができ、研修を受講することで高いレベルの技術を取得している。

下請けは絶対しないというのがポリシーで会社を運営している。

ライバルは大手企業であるが、それらの会社にも負けない技術力はある。","「上場することを目指している」

上場する理由は社員の成長のためである。上場するということは株主に自社の株を買ってもらうので、それに見合った仕事を株主に対して返さなければならない。そのため、社員一人ひとりが自分の仕事に対して、責任と誇りをもって仕事に取り組んでほしいという願いもあり、そのことが社員の成長を促すと考えている。","発言力～自分の意見をわかりやすく伝える力～

相手の満足できる仕事にするために、相手の求めるものを想像し、相手に自分自分を伝える力が必要である。","・Microsoft社やGoogle社のパートナー企業であるために、各本社で開催されるセミナーへ参加する事ができる。

・ITは技術職と思われがちだがお客様のことを第一に考える必要があるためコミュニケーションや営業などで必要なスキルを先輩社員が指導している。","明るく、切り替えができて嘘をつかない人

上司から怒られたり、注意されるのは当たり前。その後の立ち直りが成長そのものであり、立ち直り（切り替え）が早い人ほど望ましい。",データなし,Microsoft社の事例に紹介されている内容に関して,とても丁寧に対応してくださりました。今回の面接会で唯一のIT業界で事前準備や予備知識も全くなかったために、重複する質問や言葉の意味を聞く場面が多々ありましたが、丁寧にお答えくださいました。青森に本社はありますが、ライバル企業がNECや富士通といったビックネームだったのには驚きました。しかし、インタビューをしているうちに同等に渡り歩ける確かな技術力に納得がいきました。,人事兼代表であるため、大変緊張しましたが、自分たちの活動に対して興味を持ってくださり、話しやすい雰囲気を作ってくださいました。インタビューをしていて「下請けは社員の負担が大きすぎる」といっており、下請けの現状と社員の成長を第一に考えているということを教えて頂きました。この会社に誇りを持っている方だと感じました。
三沢奥入瀬観光開発,平成１６年,１４人,０人,-,-,１００万円,サービス・宿泊業,代表取締役　佐藤　正満,"人事総務ユニットディレクター

田中　久美子",データなし,平成２５年　１０人,今　重彦さん,入社9年目,３３歳,１人ひとりが意見を言える、また、その意見を聞くという会社の仕組みがあるから。接客業に興味を持っていたから。,ホテル業務全般。人事の総務＆採用業務担当。,月２１～３５時間,"【フラットな組織】

組織がフラットであり、若手社員でも発言しやすい環境が整っている。また、個々の意見を尊重し、それによって入社時から決断力を養っている。

【マルチタスク】

業務のやり方は「マルチタスク」という形を取っているため、様々な業務に携わるため、個人が成長していき、全員が同じレベルのサービスを提供することができる。そのうえで、「究極の顧客志向」を掲げ、常にお客様の立場に立ったサービスを心掛けている。

【運営特化】

ホテル・旅館の所有をせず、「運営」に特化している。そのため、この１０年間で全国３２施設を運営するに至った。","日本でも世界での認められるような、また旅館・ホテルの運営を任せたいと思われるようなリゾート施設になること。

お客様にとっては、旅の目的としてお越しいただけるようになり、「ここに来てよかった」と言って頂けるようになること。",主体性がある：マルチタスクでの業務、フラットな組織で自発的な考え・行動を行うスタッフが多い職場のため、「自分でやろう」「こうした方がお客様にとっていいのではないか」と考え、行動できるスタッフ　　　,"年に一度、全社員研修を実施しており、グループ全体の戦略・目標・コンセプト・等の発表・確認を行っている。また、接客研修も年に一度実施。

入社１年目はOJT制度があり、１年間で青森県の地域限定勤務であれば青森屋・奥入瀬渓流ホテルの２施設に加えて、県外のグループ施設に短期間赴任し、実際の接客を行いながらの研修を行っている。

また、ビジネススキルやご当地の文化を学ぶための「麓村塾」と呼ばれる社内ビジネススクール（無料で誰でも参加可能）も開催されている。",お客様対応においては１対１で接する機会が多いので、自発的に考え、行動する意志と実行力を培っていただきたいと考えています。また、早い段階で先輩に頼らず、自分一人で様々な事象に対応・解決できる決断力も養っていただきたいと考えています。,年に一回の社員会（全社員研修後）開催。永年勤続表彰やビンゴ大会などを行っている。また、新入社員歓迎会も実施。,星野リゾートグループでどの施設に興味がありますか,教育制度がとても充実していて、若手が自立して動けるような体制が整っていて、また個人の意見もしっかりと聞いてくれるので若手にとって働きやすい環境だと思った。マルチタスク制なので様々な業務を覚えることができ、流れ作業のようなものが一切なく、毎日が新鮮に感じられるのではないだろうかと思う。究極の顧客思考なので常に上昇志向で、進化し続けるので自分自身のレベルアップにもつながるだろう。お客様を満足させるために、様々な業務を行い、自身の成長にもつなげたいという人にオススメ！,お二人とも企業について一つ一つ詳しく話してくださり、とてもインタビューしやすかったです。案内をしていただいているときやインタビュー中終始笑顔で応対していただき、従業員同士ですれ違ったりするときも挨拶を欠かさない所から職場は活気があり、かつ充実しているというように感じました。ねぶた期間中で忙しかった時期にも関わらずインタビューを快く引き受けてくださり、とても柔軟性があり、すぐに行動してくださる、実行力のある方々だと思いました。
株式会社冨士建材,-,１５人,０人,８人,７人,１２００万円,建設業,代表取締役　田中　周一,-,"・建材販売業務

・一般建築請負（リフォーム）業務",平成２５年　３人,安藤 紗弥夏さん,入社1年目　,２３歳,思い出を残しつつ新しくしていくリフォームの仕事に興味を持った。会社説明会で社長と話をし、ビジョンをイメージすることができ、あたたかくアットホームな冨士建材の仲間に入りたいと思った。,"・電話や来客の対応

・プラン作成してお客様と相談・提案をする",月２１～３５時間,"人柄が売りである。

お客様のもとにうかがって、好かれるような人が望ましい。採用するうえで目がキラキラと輝いている人、印象に残る人、雰囲気が合っていて仕事で一緒に過ごしたいと思える人など、人柄を重視して採っている。

リフォームを依頼するお客様の年齢層が高いため日中にお客様のもとにうかがうことが多く、高齢の方が感じる危険を理解し解決するために提案できるかどうかがポイントである。",県内No.1のリフォーム会社になることを目標としている。2店舗目のショールームを出す予定であり、多くのお客様の不便をなくそうと努力している。,"傾聴力がある

お客様の「お困りごと」を解決するためには一番必要な能力である",入社後1か月は社長による研修がある。会社の核である「10の行動指針」について学ぶ。先輩に同行して網戸の張替えなど簡単なことからはじまり、お客様との接し方を学んでゆく。会社らしさを身につけ、その後大きな仕事を任せられる一人前にするためにＯＪＴ制度をとっている。,変わることを恐れないこと。ニーズや客層が変化すればそれらに合わせて自分たちも変化していかなければならない。,1か月に一度の飲み会、仕事のご褒美としての社長と新入社員の飲み会、大掃除のあとのバーベキュー、忘年会がある。社員旅行は年1回。,採用活動時に冨士建材が大事にしていること。,15人と従業員数が少ないため社員同士の仲が良く、社長とも距離が近い印象を受けました。社内イベントは人間関係をよくするためのコミュニケーションの場になっているようです。春と秋が繁忙期で、仕事量の少ない冬に社員旅行に行くそうです。今年度は沖縄、去年はグアムと温かい地域に行って親睦を深めています。,人事のかたは、この会社の代表者でもあり、採用活動では説明会から最終選考まですべてに参加し、「人・人柄」を重視しているため学生との接点を増やしていて、ここまで積極的な人事の方は初めてでした。入社後も社員同士で派閥ができないように組織のトップとして監督していてとても視野の広い方だという風にも感じました。
