東和電材株式会社,１９５６年,１７４人,１４人,-,-,１億円,卸売業,代表取締役　榊　美樹,総務部,"・一般電設資材、一般電気器具、工具、環境及び省エネ商材、東和電機工業（株）製品の卸売

・電気設備工事及び配管、防災、電気通信に関する設計及び工事請負

・不動産の賃賃及び損害保険の代理業務",平成25年　6人,秋元　拡さん,入社７年目,２８歳,　会社体制のしっかりとした企業の経営に携わり、大学で学んだ経営経済の知識を活かしたいと考えていた。企業研究した際に、東和電材の会社体制の素晴らしさに魅力を感じ、県外に支店があることも成長に繋がると考えた為。,"・顧客からの商品の相談やオーダーを受ける  ・配送

・展示会など、イベントの企画や運営に参加",月０～２０時間,　日本が電気を使い始めたのが、約120年前とされており、東和電材はその60年間、電気に携わってきた。グループ全体で製造・販売・工事の一貫体制をとることができ、請負から建造物の完成まで直接関われるのが強み。お客様との信頼関係を重要視しており、何が起きても臨機応変に対応することで信頼を築く。,"「顧客満足・地域貢献・社員満足を目指している」

　福利厚生を充実させることで社員が心おきなく仕事に専念することで地域貢献・顧客満足につながると考えている。利益を上げ財務体質を強化しながら成長・発展し、顧客満足・地域貢献・社員満足の実現を目指す。","ストレス耐性がある社員

　自分の考えを持ち積極的に行動するためには、タフな心とストレスコントロール力が必要。","・若手社員育成制度：三カ年計画（1年目基礎、2年目コミュニケーション能力の受信力、3年目は発信力）によって三年で一人前に育て上げる。

・上司向けの研修もあり、職場環境も大事にしている。若手を育成、上司の指導力を向上することでモチベーション高め職場環境を充実させている。

・401Ｋ（確定拠出型年金）加入、社会保険、財形、共済会、社宅補助",熱意と誠意をもって行動し、お客様との信頼関係を大事にすること。そして些細なことに屈せず、失敗を恐れず積極的に行動していくこと。,データなし,東和電材が永続していくために必要なものは？,　取材に協力してくれた方は、どちらも積極的に答えてくれました。仕事の方が忙しく取材は簡単になってしまうかもと、事前に連絡をとっていましたが、そんな事はなくしっかり答えてくれました。取材日は気温が高めでスーツを着たくない位でしたが、さすが資材を扱っている企業ということで空調は完璧でした。様々な点で、気持ち良く取材出来ました。,　銀行員を経てから、東和電材で働き始めたとのことでしたが堅苦しさはなく、むしろ人当たりの良い方でした。採用面接では、理屈っぽい人よりも、質問に対しての受け答えがしっかりしていて、多少間違っていても誠意の感じられる人が社風に合うと語っていました。
東北化学薬品株式会社,1953年2月16日,２２１人,３８人,１６５人,５６人,８億２０４０万円,卸売業,代表取締役社長　工藤幸弘,総務部　蝦名,"１．試薬、化学工業薬品、食品添加物、農薬の販売（工場、医療器具を作る際に必要な化学薬品の販売）

２．医理化学機器、計測機器、計量機の販売（機会が交渉した場合、メーカーに送るのも請け負っている）",平成２５年３人,中澤  勇貴さん,入社3年目,２６歳,大学時代の教授から勧められ興味を持った。理系出身ということもあり卒業と同時に取得できる資格と学んだ知識を生かせる会社であった。人と話すのはもともと好きだったため営業職を志望した。,・法人ルート営業（商品の受注を受けたり、新商品の提案、量が少なければ実際に配送も行う）,月０～２０時間,"『取扱い商品が豊富、地域に根付いた企業』

この企業で取り扱っている商品数は５０００種類以上。商品は常に増え続けているので、定期的に勉強会を行っており、新商品でもすぐ提供できるようにしている。支店が弘前・青森・八戸・むつと、県内に４つありそれぞれの地域に東北化学薬品を頼りにしてくれている企業があり、その期待に応える努力を積み重ねてきたため、多くの取引先とに信頼されている。","『「東北」という名前だが、全国に取引先のある企業に』

現在、県内でのニーズに応えて安定した取引先であるが、それだけに頼らず、関東での取引先もある。これからは、全国に取引先のある企業になるために努力している。","『実行力』

口だけではだめで行動で示すことのできる人間を求めている。","『社員の将来性を見ている』

試用期間は３か月。その間にOJTや内部、外部教育を行い、その人自身の将来性や適性などを見ている。新人だけでなく、先輩社員も勉強会には参加し、常にお客様の満足のために勉強会をしている。資格取得をする際には補助あり。","『快活で元気のある人。』

口だけではだめで行動で示すことのできる人間を求めている。基本的な挨拶、外見は小奇麗で、言葉遣いのちゃんとできた人など、社会人としてきちんとした人を求めている。",データなし,自己PR。企業研究をしなければ答えられない質問,一般的な企業においては若手の方がうまく話せなかったりなどすることも多いのだが、この企業の若手の方はとても話しやすく、聞きたい内容以上のことを聞くことができた。「営業という仕事は文系」というイメージを持っていたが、理系出身の方が営業をしていて、理系に対するイメージが変わったと共に、自分に向いてる仕事を探すことの重要さを再確認した。,　取材のアポ取りでは、こちらの不手際で大変ご迷惑をおかけてしてしまったが、急遽、予定とは違う方が担当してくださり、優しく対応をしてもった。お忙しい中ということもあり、取材時間は少し短めでしたが、事前に質問内容を確認してくださっていたのでスムーズに取材することができた。
三浦建設工業株式会社,１９１６年,８３人,０人,７７人,４人,５０００万円,建設業,代表取締役　川村雄藏,総務部総務課課長　下村　潤一,"当社受託の建設工事の現場管理

・見積もり作成、図面作成、工事管理

・書類等の作成（OAによる）

・現場管理（監督）業務",平成２５年　０人,瀧川  将行さん,入社９年目　,３１歳,小学生の頃、技術者である父親が自宅の新築図面を作図しているところを見て、作図や設計の仕事に興味を持ちました。大学生になり、就活時に地元で開催された合同企業面接会へ参加、現在の会社を受験、入社することになりました。,"・図面の作図　

・客先、工事現場との打合せ、調整",月３６～時間,"「高度な技術力と確立された品質管理体制」

大正５年創業以来続く歴史のある地元企業です。特定建設業許可、ＩＳＯ9001認証、国土交通省大臣Ｈグレード認定工場保有等の認証取得をし、高度な技術力と確立された品質管理体制により、鉄骨工事物件の製造から工事、土木、建築等の総合建設工事を行っています。青森県内をはじめ、東北各地、関東方面への広範囲な営業を積極的に展開しています。何より「もの創り」にこだわり続け、将来を担う優秀な人財の育成が責務と考えております。",今日まで積み上げてきた実績と評価、そして信用を武器に新たな高度先進な設備投資、品質管理体制の構築、更なる技術力の向上、人財育成により多くの大型物件の受注を目標とします。,"『主体性、物事に進んで取り組む力がある人間』

やりたいことがある人はまっすぐその道を進める人間が望ましい。","社員の個性を尊重し仕事を通して「考える力」「行動する力」を教育します。特に技術、技能のスキルアップ、レベルアップに力を入れ、国家資格、各種資格試験の受験に対し経費等の負担する制度があります。

福利厚生として、保養所の割引利用制度、社員旅行などがあります。","「元気なあいさつをしよう」

コミュニケーションは、まず挨拶からはじめよう！

オン、オフに関わらず上司、先輩、同僚とのコミュニケーションをとることが重要です。",社員は部署、役職、年齢など関係なく、仲の良い雰囲気で年に歓迎会・納涼会・忘年会などを開催している。,所在地の市町村名を答えよ,"社員間の距離が近いという印象を受けました。又、個人を尊重した職場環境を感じました。

余談ですが、会社には「おはよう」と挨拶をする「おはようカラス」が出没するそうです？",何事にも熱意をもって行動をしている人だという印象を受けた。「どうすれば会社の魅力が学生に届くのか」という課題を自分に投げかけ、積極的に採用活動に取り組んでいるという話を聞いて、「主体性とは」この人のことを指す言葉なのだということを感じました。
第一化学株式会社,１９８３年,１４人,０人,-,-,２０００万円,卸売業,代表取締役　平　俊隆,総務部　成田早希子,有機・無機工業薬品等の卸売業,平成25年0人,阿部　吉郎さん,入社１年半,２８歳,転職を考えている時に、求人募集を見て、前に勤務していた業務とは真逆であることに逆に興味を持った。まったく違う業界で不安はあったが、これまで経験したことない世界で自分を試したいと思い入社を決めた。,"・商品の配送が主な業務内容　　（配送範囲：黒石～十和田・三沢）

・製品加工の際に補助としての手伝い

・企業から商品の相談やオーダーを受ける",月０～２０時間,"　　実際に営業に行く際にはマニュアル化することなく、その場で考え相手の要望に応える技術は他社には負けない。お客様の依頼に対し、「できない・無理」という前に最大限努力する営業技術力が強み。

　年齢層が若く、社長自身が現場で活躍していることからコミュニケーションの場が多く、アットホームな社風となっている。","『利益追求ではなく、無くてはならない企業へ』

　一人ひとりのお客様に満足してもらい、「困ったときは第一化学」と選んでもらえる事を目標としている。","課題発見力が高い社員

「常に質問をしろ」というのが口癖で、疑問を解決することで若手の成長を促している。","　明確に制度というものはないが、社長が新人教育を重視しており、疑問を解決することで若手の成長を促している。資格取得に関しても、勤務中の空き時間には勉強を推進しており、初回受講費が会社持ちでありことから若手教育の意識が会社として高いと言える。

　社長が経営している企業が複数あり、定年退職後もそこで雇用できるような仕組みになっている。",考える能力を磨くことが大切であり、マニュアルに頼ることなく、解決できるようになって欲しい。,年に数回。忘年会や、花見など季節ごとのイベントは会社全体で行っている。社内全体で仲が良いため、お昼はみんなで食堂で弁当を広げ、休日には一緒にスポーツをしたり、仕事終わりに数人で飲みに行くことも多いとのこと。,平　俊隆代表が経営しているもう一つの事業はどういった内容か？,　一番最初ということもあり、拙い取材になってしまったが、とても丁寧に答えてくれた。社長も含め、社員全体の仲の良さを終始感じられる取材だった。一つのフロアの中に受付・社長室・応接室・作業場などすべての部屋がある作りも、仲の良さを感じた要因かもしれない。,"　社員から尊敬される実力派という印象を受けた。

　インタビューの中で、社長のエピソードが何度も出てきて、尊敬されているのがよく伝わった。社長が来ると現場に緊張感が出るとのことであったが、社員に多くの職種を経験させることで成長させるという教育方法に、厳しい中にも愛情を感じることができた。"
青森トヨタ自動車株式会社,1946年6月10日,１７０人,-,-,-,６０００万円,小売業,代表取締役社長　小野大介,"店舗支援室教育・情報通信担当

　課長　石岡　美春","・トヨタ車（トヨタ店）の新車販売

・U-Car販売および買取

・自動車点検・整備・修理、部品・用品販売

・損害保険代理店",平成25年　16人（うち退職者7人）,坂本　将幸さん,入社2年目,２２歳,学生時代の接客業のアルバイトの経験から人に頼られる喜びを見出し、人との関わりのある接客業の職種につきたいと思うようになる。車が好きということもあり、学校に来ていた求人票を見て、トヨタのブランド力に惹かれたことがきっかけ。,・お客様１人１人のライフスタイルやニーズに合った車の提案・お客様対応,月２１～３５時間,圧倒的なブランド力。車の外観、内装などすべての顧客のニーズに合わせた自動車を提案、販売。そして次世代の車社会を常に視野に入れている。新しいことに挑戦し続けることを忘れない、常に上昇し続ける意識を全社員が持っている。,県内でナンバー1の会社。この会社がなくならないでほしいとお客様に思ってもらえる、この会社に勤めていてよかったと従業員が思える、お客様と従業員双方に愛され続ける会社を目指す。,"主体性のある人。新しいことに挑戦できる人。

例え相手と同じ意見でも自分の言葉で伝える。

会社のこれからを立場関係なく1人1人が考える。",最初は上司につき、仕事を見ながら覚えていく。新人から部長、部署の関係なしに全員が朝礼で新商品のロールプレイングを行う。確認テストもあり、結果を社内掲示板で公開。福利厚生として女性には育児休暇が設置されている。,"積極的に自分の言葉で自分の意見が言えること。

自分のやりたいことを見つける。",データなし,トヨタのメイン車種であるクラウンが販売され何年目か。そして何代目のクラウンであるか。,とても丁寧に対応していただきました。創業68周年でトヨタを青森に初出店させるという輝かしい歴史のある会社です。担当してくださった女性社員の方も育児休暇を取って仕事を続けていたので、女性にとっても働きやすい環境が整備されていました。面接に関しても遠方の方に対する個別の対応も考慮しています。,先輩社員の方は、会社の魅力ということでお客様との信頼関係の深さをあげていただき、お客様のことを第一に考えていることがすごく伝わってきました。担当してくださった方も私たちの質問に対し、　１つ１つ真剣に考えていただきました。そして、2人とも終始笑顔で和やかな雰囲気の中インタビューを行うことができました。
株式会社青森読売IS,１９８３年,２１人,-,９人,６人,１０００万円,広告代理業,代表取締役社長　廣井　暁,"常務取締役

鴨下　昌彦",新聞折込広告（チラシ）の企画及び広告全般への代理店業務,平成２５年　１人,杉山　貴治さん,入社７年目,３５歳,元々は、イオンの契約社員であり寿司を握ったり惣菜を作ったりしていたが、安定した職につき生活していくために求人募集を探していたら見つかった。,広告依頼の受注業務、営業などを行う。紙媒体としての広告以外にも、イベントをする際の設営の提案をしたり、テレビのＣＭの制作を請け負ったりもしている。,月２１～３５時間,青森読売ISは、今年で３２年になる。生活・地域に密着した、手軽で効果的な広告媒体として、普段読まれている新聞の中に入ってくる折込広告を主業とする、読売新聞グループの広告代理店である。名前は読売が付くが、全国・全紙の折込広告の他、新聞・雑誌・テレビ・ラジオやその他広告周辺の業務を行っている。主業である折込広告は、新聞販売店ごとに選択できるエリア特性と、新聞同様信頼性の高い媒体である。また計画して折込実施までが短期間、コストパフォーマンスがいい媒体でもある。,県内のシェア率をアップさせ、地域に密着した何でもこなせる総合広告代理店になることを目指している。そのためにもエリアマーケティングシステムを活用した営業をして、お客様のニーズに最大限応える努力をして、地域から認められる企業になることを目指している。,"主体性があり、好奇心、野心がある人

転勤の可能性があるため、どこに配属されてもよい人",教養手当として新聞代を支給され、そこから折込の何たるかを学ぶことができる。OJTで先輩が熱心に指導していて、最初に部数表を覚えるなど、数字を覚える機会が多いが、その後、実際に営業するにあたり必要な知識になっているため、そこから仕事上の基礎・基本を学ぶことができる。,主体性のない指示待ちの人、優先順位のつけられない人がいるが、自分で考え行動できる人を期待している（結果が出せる人）,新年会や歓迎会での飲みニケーションを図る。ほかにも、仕事終わりにご飯を食べに行くなど、コミュニケーションを図るようにして悩みなどを聞くなどしていて、仲の良い雰囲気を感じた。,"・うちの会社で何をやりたいですか？

・転勤はできますか？",先輩社員の杉山さんが記者と同じく、青森公立大学出身であり、気さくで話し易い人でした。そのため、あまり緊張することなく取材させていただくことができました。歓迎会や社内旅行が充実しており、組織において必要な情報の共有を重視しているように感じました。,取材している我々に対して逆に質問してみたりすることや、考え方を聞いていると、突発事項などの問題にもできることを探す柔軟な発想をした人間を求めているように思いました。